{
  "_comment": [
    "VoltPilot-Registerbild WAGO v1 (UEMS AP-05 IP-2). Die Prosa steht in wago-registerbild.md, der Aufbau und",
    "die Lese-Fälle stehen HIER. Jede Zahl steht in einer Angabe mit Herkunft: festlegung · handbuch · repo · zu erheben.",
    "Handbuch-Angaben gelten nur für die Artikel in gilt_fuer — für die 750-494 ist fast alles außer dem",
    "Prozessabbild-Aufbau zu erheben. Alle Fälle sind herkunft vertrag, belegt false: ihre Rohwerte sind ausgedacht und",
    "zeigen nur, wie ein Leser das Registerbild liest. Simulator-Fälle bringt IP-12, belegte Pilot-Fälle IP-14.",
    "Zwillinge gibt es noch keine: IP-6 (Edge-Dekodierung) und IP-7 (Kopf-Prüfung) lesen diese Datei, sobald sie",
    "gebaut sind. Wer den Aufbau ändert, ändert diese Datei, wago-registerbild.md und den Test gemeinsam.",
    "Erzeugt einmalig per Skript (Wörter kodiert aus den Absichten); geprüft von einem unabhängigen Leser im Test."
  ],
  "schema_version": "1.0",
  "$schema_datei": "./wago-registerbild.schema.json",
  "vertrag": "./wago-registerbild.md",
  "herkunft": "UEMS AP-05 §4.1, §4.5, §4.6, §8 IP-2; Entscheide E1, E2, E4, E9 vom 10.09.2026; Befunde aus IP-1 (befunde-ip1.md)",
  "zwillinge": [],
  "pruefer": ["frontend/portal/src/wagoRegisterbild.test.ts"],
  "registerbild": {"hauptversion": 1, "nebenversion": 0},
  "quellen": {
    "WAGO-750-495": {
      "titel": "Handbuch 750-495 3-Phasen-Leistungsmessmodul, Version 1.3.0, © 2023",
      "url": "https://www.wago.com/wagoweb/documentation/750/ger_manu/modules/m07500495_xxxxxxxx_0de.pdf",
      "abgerufen": "2026-09-10"
    },
    "WAGO-750-494": {
      "titel": "Handbuch 750-494(/xxx-xxx), Version 1.5.0",
      "url": "https://www.wago.com/wagoweb/documentation/750/ger_manu/modules/m07500494_xxxxxxxx_0de.pdf",
      "abgerufen": "2026-09-10"
    },
    "WAGO-750-362": {
      "titel": "Manual 750-362 FC Modbus TCP G4, Version 1.1.1",
      "url": "https://www.wago.com/wagoweb/documentation/750/eng_manu/coupler_controller/m07500362_xxxxxxxx_0en.pdf",
      "abgerufen": "2026-09-10"
    }
  },
  "parameter": [
    {
      "schluessel": "basisadresse",
      "bedeutung": "Protokolladresse (0-basiert, wie im Modbus-Telegramm) des ersten Kopf-Worts",
      "werte": "0 … 65535; basisadresse + kopflaenge + kartenzahl · kartenblocklaenge ≤ 65536",
      "angabe": {"art": "zu erheben", "wo": "Programm des Installateurs → Hardwareblatt §3 „Basisadresse“; Pilotschritt 1"}
    },
    {
      "schluessel": "funktionscode",
      "bedeutung": "Mit welchem Modbus-Funktionscode die Box das Registerbild liest",
      "werte": "3 (Holding Register) oder 4 (Input Register)",
      "angabe": {"art": "zu erheben", "wo": "Programm des Installateurs → Hardwareblatt §4 „Funktionscode“; Pilotschritt 1"}
    },
    {
      "schluessel": "wortfolge",
      "bedeutung": "Reihenfolge der zwei Wörter eines 32-bit-Werts; das Kopf-Feld wortfolge_pruefwert bestätigt sie",
      "werte": "big (höherwertiges Wort zuerst) oder little (niederwertiges zuerst)",
      "angabe": {"art": "zu erheben", "wo": "Hardwareblatt §3 „Wortfolge der 32-bit-Werte“; Pilotschritt 2"}
    },
    {
      "schluessel": "katalog_endian",
      "bedeutung": "Entsprechung im Messpunkt-Katalog: big → big, little → word_little_byte_big",
      "werte": "big, word_little_byte_big",
      "angabe": {
        "art": "repo",
        "wert": ["big", "word_little_byte_big"],
        "fundstelle": "catalog/measurement-points/schema/catalog.schema.json:301"
      }
    },
    {
      "schluessel": "soll",
      "bedeutung": "Erwarteter Aufbau, gegen den der Kopf und jeder Karten-Block geprüft werden: kartenzahl, controller_kennung, je Karte steckplatz, kartentyp, variante",
      "werte": "aus dem Hardwareblatt der Anlage",
      "angabe": {"art": "zu erheben", "wo": "Erhebungsbogen B1/B2 → Hardwareblatt §2; Pilotschritt 1"}
    }
  ],
  "kopf": {
    "laenge": 12,
    "felder": [
      {
        "offset": 0,
        "woerter": 1,
        "schluessel": "signatur_1",
        "typ": "UInt16",
        "inhalt": "0x5650 („VP“)",
        "wert": {"art": "festlegung", "wert": 22096, "fundstelle": "wago-registerbild.md §3"}
      },
      {
        "offset": 1,
        "woerter": 1,
        "schluessel": "signatur_2",
        "typ": "UInt16",
        "inhalt": "0x5242 („RB“)",
        "wert": {"art": "festlegung", "wert": 21058, "fundstelle": "wago-registerbild.md §3"}
      },
      {
        "offset": 2,
        "woerter": 1,
        "schluessel": "hauptversion",
        "typ": "UInt16",
        "inhalt": "1",
        "wert": {"art": "festlegung", "wert": 1, "fundstelle": "wago-registerbild.md §6"}
      },
      {
        "offset": 3,
        "woerter": 1,
        "schluessel": "nebenversion",
        "typ": "UInt16",
        "inhalt": "0 in Fassung 1.0; nur additive Stufen",
        "wert": {"art": "festlegung", "wert": 0, "fundstelle": "wago-registerbild.md §6"}
      },
      {
        "offset": 4,
        "woerter": 1,
        "schluessel": "kopflaenge",
        "typ": "UInt16",
        "inhalt": "12 in 1.0; ein Leser verlangt ≥ 12",
        "wert": {"art": "festlegung", "wert": 12, "fundstelle": "wago-registerbild.md §6"}
      },
      {
        "offset": 5,
        "woerter": 1,
        "schluessel": "kartenblocklaenge",
        "typ": "UInt16",
        "inhalt": "42 in 1.0; ein Leser verlangt ≥ 42",
        "wert": {"art": "festlegung", "wert": 42, "fundstelle": "wago-registerbild.md §6"}
      },
      {
        "offset": 6,
        "woerter": 1,
        "schluessel": "kartenzahl",
        "typ": "UInt16",
        "inhalt": "Anzahl der Karten-Blöcke; muss dem Soll entsprechen",
        "wert": {"art": "zu erheben", "wo": "Erhebungsbogen B2 → Hardwareblatt §2; Pilotschritt 1"}
      },
      {
        "offset": 7,
        "woerter": 1,
        "schluessel": "herzschlag",
        "typ": "UInt16",
        "inhalt": "zählt je Sekunde um 1, beginnt beim Programmstart mit 0, läuft von 65535 auf 0",
        "wert": {"art": "zu erheben", "wo": "Hardwareblatt §3 „Herzschlag“ (zwei Lesungen); Pilotschritt 1"},
        "regeln": [
          {"name": "takt", "angabe": {"art": "festlegung", "wert": "1 s", "fundstelle": "wago-registerbild.md §3"}},
          {"name": "start", "angabe": {"art": "festlegung", "wert": 0, "fundstelle": "wago-registerbild.md §3"}},
          {
            "name": "ueberlauf",
            "angabe": {"art": "festlegung", "wert": [65535, 0], "fundstelle": "wago-registerbild.md §3"}
          },
          {
            "name": "steht_nach_lesungen",
            "angabe": {"art": "festlegung", "wert": 3, "fundstelle": "Konzept AP-05 §4.6 und §6.3"}
          }
        ]
      },
      {
        "offset": 8,
        "woerter": 2,
        "schluessel": "wortfolge_pruefwert",
        "typ": "UInt32",
        "inhalt": "0x01020304, geschrieben wie jeder Messwert",
        "wert": {"art": "festlegung", "wert": 16909060, "fundstelle": "wago-registerbild.md §3"}
      },
      {
        "offset": 10,
        "woerter": 2,
        "schluessel": "controller_kennung",
        "typ": "UInt32",
        "inhalt": "vom Installateur gesetzte Zahl, 0 = nicht gesetzt; kein Identitätsbeweis",
        "wert": {"art": "zu erheben", "wo": "Installateur → Hardwareblatt §2; Pilotschritt 1"},
        "regeln": [
          {
            "name": "nicht_gesetzt",
            "angabe": {"art": "festlegung", "wert": 0, "fundstelle": "wago-registerbild.md §3"}
          }
        ]
      }
    ]
  },
  "karte": {
    "laenge": 42,
    "felder": [
      {
        "offset": 0,
        "woerter": 1,
        "schluessel": "steckplatz",
        "typ": "UInt16",
        "inhalt": "Position am Klemmenbus; 1 = erste Klemme rechts neben der Steuerung",
        "wert": {"art": "zu erheben", "wo": "Erhebungsbogen B1 → Hardwareblatt §2; Pilotschritt 1"},
        "regeln": [
          {
            "name": "zaehlung",
            "angabe": {
              "art": "festlegung",
              "wert": "1 = erste Klemme rechts neben der Steuerung",
              "fundstelle": "docs/wago/erhebungsbogen.md B1"
            }
          }
        ]
      },
      {
        "offset": 1,
        "woerter": 1,
        "schluessel": "kartentyp",
        "typ": "UInt16",
        "inhalt": "494 oder 495 (Artikelnummer ohne „750-“)",
        "wert": {"art": "zu erheben", "wo": "Erhebungsbogen B2 → Hardwareblatt §2; Pilotschritt 1"},
        "regeln": [
          {
            "name": "vokabular",
            "angabe": {"art": "festlegung", "wert": [494, 495], "fundstelle": "Entscheid AP-05 E1 vom 10.09.2026"}
          },
          {
            "name": "schreibweise",
            "angabe": {
              "art": "handbuch",
              "wert": "Artikelnummer ohne führende 750, ein Wort je Klemme",
              "fundstelle": "WAGO-750-362 S. 205",
              "gilt_fuer": ["750-362"]
            }
          }
        ]
      },
      {
        "offset": 2,
        "woerter": 1,
        "schluessel": "variante",
        "typ": "UInt16",
        "inhalt": "Teil 1 · 1000 + Teil 2 der Variantennummer: /000-001 → 1, /025-001 → 25001, ohne Variante → 0",
        "wert": {"art": "zu erheben", "wo": "Erhebungsbogen B2 → Hardwareblatt §2; Pilotschritt 1"},
        "regeln": [
          {
            "name": "formel",
            "angabe": {"art": "festlegung", "wert": "teil1 · 1000 + teil2", "fundstelle": "wago-registerbild.md §4"}
          }
        ]
      },
      {
        "offset": 3,
        "woerter": 1,
        "schluessel": "gueltigkeit",
        "typ": "Bitfeld",
        "inhalt": "welche Teile des Blocks das Programm gelesen hat (§4.1)",
        "wert": {"art": "festlegung", "wert": "Bit 0–3 nach §4.1, Bit 4–15 = 0", "fundstelle": "wago-registerbild.md §4.1"}
      },
      {
        "offset": 4,
        "woerter": 1,
        "schluessel": "kartenregister_32",
        "typ": "UInt16",